{
  "$schema": "../../schema/table.schema.json",
  "title": "0021 非表示時もフィルター維持",
  "hidden_column_filter": "keep",
  "columns": [
    "ID",
    "分類",
    "担当",
    "説明"
  ],
  "rows": [
    {
      "ID": "K-01",
      "分類": "A",
      "担当": "佐藤",
      "説明": {
        "type": "multiline",
        "lines": [
          "分類をAだけに絞り込んでから、分類列を非表示にしてください。"
        ]
      }
    },
    {
      "ID": "K-02",
      "分類": "B",
      "担当": "鈴木",
      "説明": {
        "type": "multiline",
        "lines": [
          "非表示でも絞り込みは維持され、この行は表示されません。"
        ]
      }
    },
    {
      "ID": "K-03",
      "分類": "A",
      "担当": "田中",
      "説明": {
        "type": "multiline",
        "lines": [
          "2件のままで、非表示列のフィルター適用中というメッセージが出ます。",
          "再読み込みやHTML再生成後も状態を復元します。"
        ]
      }
    }
  ]
}
