{
  "$schema": "../schema/table.schema.json",
  "title": "001 基本表示・フィルター",
  "columns": [
    "番号",
    "状態",
    "担当",
    "件数",
    "備考"
  ],
  "column_options": {
    "件数": {
      "align": "right"
    }
  },
  "rows": [
    {
      "番号": "001",
      "状態": "完了",
      "担当": "佐藤",
      "件数": "12",
      "備考": {
        "type": "multiline",
        "lines": [
          "通常文字列・日本語の表示を確認します。",
          {
            "type": "link",
            "text": "サンプルリンク",
            "url": "https://example.com/"
          },
          "",
          "空行を挟んだ説明です。"
        ]
      }
    },
    {
      "番号": "002",
      "状態": "確認中",
      "担当": "鈴木",
      "件数": "0",
      "備考": {
        "type": "multiline",
        "lines": [
          "<表示確認> & \"文字列\" はHTMLとして実行されません。",
          "長い文章がセルの幅に応じて折り返され、ほかの列を隠しても内容を確認できることを確かめます。"
        ]
      }
    },
    {
      "番号": "003",
      "状態": "未着手",
      "担当": "佐藤",
      "件数": "7",
      "備考": {
        "type": "multiline",
        "lines": [
          "状態と担当の両方で絞り込めます。"
        ]
      }
    },
    {
      "番号": "004",
      "状態": "完了",
      "担当": "",
      "件数": "25",
      "備考": ""
    },
    {
      "番号": "005",
      "状態": "確認中",
      "担当": "田中",
      "件数": "3",
      "備考": {
        "type": "multiline",
        "lines": [
          "状態が「完了」なら2件、さらに担当が「佐藤」なら1件になります。"
        ]
      }
    }
  ]
}
