{
  "$schema": "../schema/table.schema.json",
  "title": "002 列表示・非表示時に解除",
  "hidden_column_filter": "clear",
  "columns": [
    "ID",
    "分類",
    "優先度",
    "内部コード",
    "説明"
  ],
  "column_options": {
    "内部コード": {
      "label": "内部コード（初期非表示）",
      "visible": false
    }
  },
  "rows": [
    {
      "ID": "C-01",
      "分類": "A",
      "優先度": "高",
      "内部コード": "INT-101",
      "説明": {
        "type": "multiline",
        "lines": [
          "分類をAだけにすると2件になります。"
        ]
      }
    },
    {
      "ID": "C-02",
      "分類": "B",
      "優先度": "低",
      "内部コード": "INT-102",
      "説明": {
        "type": "multiline",
        "lines": [
          "分類列を非表示にすると絞り込みが解除され、3件に戻ります。"
        ]
      }
    },
    {
      "ID": "C-03",
      "分類": "A",
      "優先度": "中",
      "内部コード": "INT-103",
      "説明": {
        "type": "multiline",
        "lines": [
          "表示列パネルのリセットで内部コードが再び非表示になります。"
        ]
      }
    }
  ]
}
