{
  "$schema": "../../schema/table.schema.json",
  "title": "",
  "assets": {
    "css": "",
    "js": null
  },
  "alignment": {
    "header": "",
    "body": null
  },
  "column_options": {
    "金額": {
      "align": "",
      "visible": null
    },
    "説明": null
  },
  "hidden_column_filter": "",
  "columns": [
    "番号",
    "区分",
    "金額",
    "説明"
  ],
  "rows": [
    {
      "番号": "E-01",
      "区分": "継承",
      "金額": "10000",
      "説明": {
        "type": "multiline",
        "lines": [
          "titleが空なのでページタイトルとメニュー名は0031になります。"
        ]
      }
    },
    {
      "番号": "E-02",
      "区分": "空値",
      "金額": "60",
      "説明": {
        "type": "multiline",
        "lines": [
          "assetsとalignmentの空文字・nullは共通設定を引き継ぎます。",
          "金額は003の列設定を継承して右寄せです。"
        ]
      }
    },
    {
      "番号": "E-03",
      "区分": "",
      "金額": "",
      "説明": {
        "type": "multiline",
        "lines": [
          "空セルはフィルターの「(空白)」で確認できます。"
        ]
      }
    }
  ]
}
